<?xml version="1.0" encoding="utf-8"?>
<request xmlns="http://fuzzino.fuzzing.fokus.fraunhofer.de/request" xmlns:xsi="http://www.w3.org/2001/XMLSchema-instance"
	xsi:schemaLocation="http://fuzzino.fuzzing.fokus.fraunhofer.de/request
	./fuzzingRequest.xsd">

<string name="SimpleStringRequest" maxValues="10">
    <specification type="String" nullTerminated="true" encoding="UTF8" />
    <validValues>
        <value>ABC</value>
        <operator>StringCase</operator>
    </validValues>
</string>

<number name="SimpleNumberRequest" maxValues="2">
    <specification type="integer" bits="32" signed="true" />
</number>

<!-- not yet implemented
<structure name="SimpleStructureRequest" maxValues="2" maxMutations="3" fuzzStructure="true" fuzzValues="false">
    <specification ordered="true">
        <field ref="SimpleStringRequest" />
        <field ref="SimpleNumberRequest" fuzz="false"/>
    </specification>
</structure>

<collection name="SimpleCollectionRequest" maxValues="2" minMutations="1" maxMutations="3" fuzzStructure="true" fuzzValues="true">
    <specification ref="SimpleNumberRequest" unique="false" ordered="true" minLength="3" maxLength="3" />
    <validCollections>
    	<validCollection name="firstValidCollection">
        	<value>1</value>
        	<value>2</value>
        	<value>3</value>
    	</validCollection>
    	<operator>CollectionLength</operator>
    </validCollections>
</collection>
-->

</request>